{
  "$schema": "http://json-schema.org/draft-07/schema#",
  "$id": "https://judokon.dev/schemas/statNames.schema.json",
  "type": "array",
  "items": {
    "type": "object",
    "properties": {
      "id": {
        "type": "integer",
        "description": "Unique identifier for the stat"
      },
      "statIndex": {
        "type": "integer",
        "enum": [1, 2, 3, 4, 5],
        "description": "Ordering index for display"
      },
      "name": {
        "type": "string",
        "description": "English label for the stat"
      },
      "category": {
        "type": "string",
        "description": "Stat category such as 'Judo'"
      },
      "japanese": {
        "type": "string",
        "description": "Japanese name of the stat"
      },
      "description": {
        "type": "string",
        "description": "Short explanation of the stat"
      }
    },
    "required": [
      "id",
      "statIndex",
      "name",
      "category",
      "japanese",
      "description"
    ],
    "additionalProperties": false
  }
}
